{
  "schema_version": "rhize-task-graph-v1",
  "expected_checkout_fingerprint": "0000000000000000000000000000000000000000000000000000000000000000",
  "concurrency_budget": 3,
  "coordinator_slots_reserved": 1,
  "context_item_budget": 4,
  "nodes": [
    {"id": "required", "deliverable": "required fact", "inputs": [], "output_contract": {"kind": "json", "max_items": 1}, "depends_on": [], "reads": ["source-a"], "writes": [], "resources": [], "requires_approval": false, "external_effect": "none", "optional": false, "timeout_seconds": 60, "retry": {"max_attempts": 1, "idempotent": false, "renew_approval": false}, "verification_owner": "coordinator"},
    {"id": "optional", "deliverable": "optional corroboration", "inputs": [], "output_contract": {"kind": "json", "max_items": 1}, "depends_on": [], "reads": ["source-b"], "writes": [], "resources": [], "requires_approval": false, "external_effect": "none", "optional": true, "timeout_seconds": 60, "retry": {"max_attempts": 1, "idempotent": false, "renew_approval": false}, "verification_owner": "coordinator"}
  ]
}
